{
	"schemaVersion": "rag-product-plan/v2",
	"pipeline": {
		"schemaVersion": "rag-pipeline-ir/v2",
		"inputs": [
			{
				"id": "corpus",
				"kind": "corpus",
				"bindingMode": "artifact",
				"artifactRole": "corpus",
				"manifestSchema": "rag-corpus-snapshot-manifest/v2",
				"digest": "sha256:b7cdc954aeb8a695e9d9b2b80f7e62031901ef7dca739bad9979ba87b46a591a"
			},
			{
				"id": "query",
				"kind": "query",
				"bindingMode": "dataset"
			}
		],
		"nodes": [
			{
				"id": "n-6761d69ad948a76579b7",
				"operator": {
					"kind": "units.identity",
					"version": "v1"
				},
				"inputs": [
					{
						"port": "corpus",
						"from": {
							"nodeId": "corpus",
							"port": "out"
						}
					}
				],
				"config": {}
			},
			{
				"id": "n-806ee8a8fb83b28f314f",
				"operator": {
					"kind": "chunks.recursive",
					"version": "v1"
				},
				"inputs": [
					{
						"port": "units",
						"from": {
							"nodeId": "n-6761d69ad948a76579b7",
							"port": "units"
						}
					}
				],
				"config": {
					"overlap": 120,
					"size": 800,
					"unicodePolicy": "utf8-boundary"
				}
			},
			{
				"id": "n-feaec7d470a94d9eddcc",
				"operator": {
					"kind": "representations.raw",
					"version": "v1"
				},
				"inputs": [
					{
						"port": "chunks",
						"from": {
							"nodeId": "n-806ee8a8fb83b28f314f",
							"port": "chunks"
						}
					}
				],
				"config": {
					"name": "raw"
				}
			},
			{
				"id": "n-a21498359de622386df7",
				"operator": {
					"kind": "index.bleve-multi",
					"version": "v1"
				},
				"inputs": [
					{
						"port": "representations.raw",
						"from": {
							"nodeId": "n-feaec7d470a94d9eddcc",
							"port": "representations"
						}
					}
				],
				"config": {
					"representationKinds": ["raw"]
				}
			},
			{
				"id": "n-0f5268bd5029dcbc8f87",
				"operator": {
					"kind": "retrieve.vector",
					"version": "v1"
				},
				"inputs": [
					{
						"port": "index",
						"from": {
							"nodeId": "n-a21498359de622386df7",
							"port": "index"
						}
					},
					{
						"port": "query",
						"from": {
							"nodeId": "query",
							"port": "out"
						}
					}
				],
				"config": {
					"filter": {},
					"representation": "raw",
					"topK": 30
				},
				"order": 1
			},
			{
				"id": "n-3603f877924605d4a2b2",
				"operator": {
					"kind": "retrieve.bm25",
					"version": "v1"
				},
				"inputs": [
					{
						"port": "index",
						"from": {
							"nodeId": "n-a21498359de622386df7",
							"port": "index"
						}
					},
					{
						"port": "query",
						"from": {
							"nodeId": "query",
							"port": "out"
						}
					}
				],
				"config": {
					"filter": {},
					"representation": "raw",
					"topK": 30
				}
			},
			{
				"id": "n-3f4822fa0eafb0b8e01d",
				"operator": {
					"kind": "collapse.parent",
					"version": "v1"
				},
				"inputs": [
					{
						"port": "hits",
						"from": {
							"nodeId": "n-0f5268bd5029dcbc8f87",
							"port": "hits"
						}
					}
				],
				"config": {
					"representative": "scoreThenRepresentationId",
					"scope": "unit"
				},
				"order": 1
			},
			{
				"id": "n-c4c8a018907e86bd6eb0",
				"operator": {
					"kind": "collapse.parent",
					"version": "v1"
				},
				"inputs": [
					{
						"port": "hits",
						"from": {
							"nodeId": "n-3603f877924605d4a2b2",
							"port": "hits"
						}
					}
				],
				"config": {
					"representative": "scoreThenRepresentationId",
					"scope": "unit"
				}
			},
			{
				"id": "n-9424e8c1693db66a1895",
				"operator": {
					"kind": "fusion.weighted-rrf",
					"version": "v1"
				},
				"inputs": [
					{
						"port": "channel.raw.bm25",
						"from": {
							"nodeId": "n-c4c8a018907e86bd6eb0",
							"port": "parents"
						}
					},
					{
						"port": "channel.raw.vector",
						"from": {
							"nodeId": "n-3f4822fa0eafb0b8e01d",
							"port": "parents"
						}
					}
				],
				"config": {
					"rankConstant": 60,
					"weights": {
						"raw.vector": 2
					}
				}
			},
			{
				"id": "n-0f77443e4d5fd86d2b08",
				"operator": {
					"kind": "collapse.final",
					"version": "v1"
				},
				"inputs": [
					{
						"port": "parents",
						"from": {
							"nodeId": "n-9424e8c1693db66a1895",
							"port": "parents"
						}
					}
				],
				"config": {
					"representative": "scoreThenRepresentationId",
					"scope": "unit"
				}
			},
			{
				"id": "n-4833efa7ef7b75e8e46b",
				"operator": {
					"kind": "hydrate.source-evidence",
					"version": "v1"
				},
				"inputs": [
					{
						"port": "chunks",
						"from": {
							"nodeId": "n-806ee8a8fb83b28f314f",
							"port": "chunks"
						}
					},
					{
						"port": "parents",
						"from": {
							"nodeId": "n-0f77443e4d5fd86d2b08",
							"port": "parents"
						}
					}
				],
				"config": {
					"policy": "best-contribution-then-id"
				}
			}
		],
		"outputs": [
			{
				"name": "evidence",
				"kind": "evidence",
				"from": {
					"nodeId": "n-4833efa7ef7b75e8e46b",
					"port": "evidence"
				}
			}
		]
	},
	"bindings": [
		{
			"slotId": "corpus",
			"role": "corpus",
			"kind": "manifest",
			"digest": "sha256:b7cdc954aeb8a695e9d9b2b80f7e62031901ef7dca739bad9979ba87b46a591a",
			"sizeBytes": 10,
			"schemaVersion": "rag-corpus-snapshot-manifest/v2"
		}
	],
	"citations": {
		"mode": "required",
		"requireSourceText": true
	},
	"runtime": {
		"maxResults": 10,
		"tracePolicy": "authoritative",
		"failurePolicy": "fail-closed"
	},
	"display": {
		"name": "qualification"
	}
}
